{
  "$schema": "../schemas/runtime-capability-matrix.schema.json",
  "schema_version": 1,
  "kind": "jfg-runtime-capability-matrix",
  "privacy": "public-safe-aggregate-only",
  "pins": {
    "jfg_decomp": "b49aa4791e8fb1e7acd3bba10346876358d0a9a7",
    "n64recomp": "ffb39cdad1da5de07eaaa48bd1db4a89a7986771",
    "n64modernruntime": "589bbf018a3e6d3646ddf7de1e7919f1b7e99bb1"
  },
  "gate": {
    "id": "G2",
    "decision": "no-go-current-pin",
    "broad_phase4_authorized": false,
    "required_blocker_ids": [
      "anti-tamper-traps",
      "cache-operations",
      "controller-pak-save",
      "decompression",
      "direct-rcp-registers",
      "kseg-aliases",
      "pi-dma",
      "tlb-mappings"
    ]
  },
  "capabilities": [
    {
      "id": "direct-rcp-registers",
      "runtime_status": "unsupported",
      "fundamental_blocker": true,
      "target_evidence": [
        {
          "id": "target-rcp-static-candidates",
          "kind": "private-static-aggregate",
          "confidence": "candidate",
          "candidate_count": 106,
          "summary": "Static decoding found hardware-segment upper-immediate candidates; individual sites remain private and require classification."
        }
      ],
      "runtime_evidence": [
        {
          "id": "runtime-no-general-register-broker",
          "kind": "pinned-source-inspection",
          "confidence": "observed",
          "summary": "The pinned runtime exposes subsystem bridges but no general fail-closed broker for arbitrary direct hardware-register access."
        }
      ],
      "fallback": {
        "id": "strict-register-broker",
        "status": "synthetic-tested",
        "test_id": "unknown-register-fails-closed",
        "strategy": "Route classified direct accesses through an allowlisted broker and reject every unknown register identifier.",
        "limitations": "The synthetic test proves fail-closed dispatch only; every target candidate still needs private classification and a behavioral oracle."
      },
      "next_gate": "Classify every candidate by subsystem and prove that each required read and write has an explicit emulation contract."
    },
    {
      "id": "kseg-aliases",
      "runtime_status": "partial",
      "fundamental_blocker": true,
      "target_evidence": [
        {
          "id": "target-kseg-static-candidates",
          "kind": "private-static-aggregate",
          "confidence": "candidate",
          "candidate_count": 130,
          "summary": "Static decoding found direct-mapped alias candidates; the aggregate includes hardware-register candidates and is not a proven execution count."
        }
      ],
      "runtime_evidence": [
        {
          "id": "runtime-kseg-translation",
          "kind": "pinned-source-inspection",
          "confidence": "observed",
          "summary": "The runtime translates both direct-mapped aliases in its address helper, while generated ordinary memory access assumes the cached alias base."
        }
      ],
      "fallback": {
        "id": "central-address-translator",
        "status": "synthetic-tested",
        "test_id": "kseg-alias-translation",
        "strategy": "Normalize both direct-mapped aliases at a checked address boundary before host memory access.",
        "limitations": "The synthetic translator does not prove that every generated memory operation is routed through the boundary."
      },
      "next_gate": "Run generated-code probes for both aliases and reject any access that bypasses the checked translator."
    },
    {
      "id": "tlb-mappings",
      "runtime_status": "unsupported",
      "fundamental_blocker": true,
      "target_evidence": [
        {
          "id": "target-tlb-static-candidates",
          "kind": "private-static-aggregate",
          "confidence": "candidate",
          "candidate_count": 4,
          "summary": "Static decoding found a small set of TLB-instruction candidates, while the inspected project source had no direct high-level mapping calls."
        }
      ],
      "runtime_evidence": [
        {
          "id": "runtime-tlb-stub",
          "kind": "pinned-source-inspection",
          "confidence": "observed",
          "summary": "The pinned runtime leaves its all-entry unmap bridge empty and the pinned recompiler describes relocation support for mapped code as future work."
        }
      ],
      "fallback": {
        "id": "explicit-static-mappings",
        "status": "synthetic-tested",
        "test_id": "explicit-tlb-mapping",
        "strategy": "Represent only proven mappings in a bounded translation table and fail closed outside those ranges.",
        "limitations": "The synthetic mapping test does not establish whether any candidate executes or whether runtime remapping is required."
      },
      "next_gate": "Classify the instruction candidates and prove either non-execution or a complete mapping and relocation set."
    },
    {
      "id": "cache-operations",
      "runtime_status": "partial",
      "fundamental_blocker": true,
      "target_evidence": [
        {
          "id": "target-cache-instructions",
          "kind": "private-static-aggregate",
          "confidence": "candidate",
          "candidate_count": 9,
          "summary": "Static decoding found cache-instruction candidates."
        },
        {
          "id": "target-cache-api-occurrences",
          "kind": "private-static-aggregate",
          "confidence": "observed",
          "candidate_count": 12,
          "summary": "Lexical inspection found cache-maintenance API occurrences, including use around code and overlay mutation."
        }
      ],
      "runtime_evidence": [
        {
          "id": "runtime-cache-noops",
          "kind": "pinned-source-inspection",
          "confidence": "observed",
          "summary": "The pinned runtime implements the standard cache-maintenance bridges as no-ops."
        }
      ],
      "fallback": {
        "id": "host-code-coherency-gate",
        "status": "synthetic-tested",
        "test_id": "cache-coherency-gate",
        "strategy": "Count every native-code mutation by region and require one subsequent host invalidation per recorded write before execution.",
        "limitations": "The synthetic gate proves per-write accounting and rejection only; native code-page integration and all target mutation sites remain unproven.",
        "verified_properties": [
          "per-write-invalidation-accounting",
          "reject-execution-while-dirty"
        ],
        "unproven_properties": [
          "native-code-page-integration",
          "target-mutation-site-coverage"
        ]
      },
      "next_gate": "Prove every code mutation and overlay relocation reaches a host invalidation hook before execution."
    },
    {
      "id": "pi-dma",
      "runtime_status": "partial",
      "fundamental_blocker": true,
      "target_evidence": [
        {
          "id": "target-pi-api-occurrences",
          "kind": "private-static-aggregate",
          "confidence": "observed",
          "candidate_count": 1,
          "summary": "Lexical inspection found a direct standard PI transfer occurrence; additional calls may remain in unmatched or library code."
        }
      ],
      "runtime_evidence": [
        {
          "id": "runtime-pi-standard-path",
          "kind": "pinned-source-inspection",
          "confidence": "observed",
          "summary": "Standard and handle-based transfers are implemented, but raw variants terminate and alignment or device-range gaps remain."
        }
      ],
      "fallback": {
        "id": "bounded-dma-broker",
        "status": "synthetic-tested",
        "test_id": "bounded-dma-copy",
        "strategy": "Use a checked byte-copy broker with explicit device bounds and exactly one completion event.",
        "limitations": "The synthetic broker does not yet reproduce hardware timing, priority, alignment quirks, or every device region."
      },
      "next_gate": "Replay representative aligned and unaligned transfers and prove completion-message ordering against the private oracle."
    },
    {
      "id": "decompression",
      "runtime_status": "unverified",
      "fundamental_blocker": true,
      "target_evidence": [
        {
          "id": "target-decompression-occurrences",
          "kind": "private-static-aggregate",
          "confidence": "observed",
          "candidate_count": 11,
          "summary": "Lexical inspection confirms a game-specific compressed-asset path with a hand-written low-level component."
        }
      ],
      "runtime_evidence": [
        {
          "id": "runtime-decompression-callback",
          "kind": "pinned-source-inspection",
          "confidence": "observed",
          "summary": "The pinned runtime has an optional project callback boundary for compressed code, not a proven implementation of the target asset format."
        }
      ],
      "fallback": {
        "id": "bounded-decompression-callback",
        "status": "synthetic-tested",
        "test_id": "decompressor-callback-boundary",
        "strategy": "Supply an independently reviewed callback behind strict input and output bounds, output-type validation, and missing-handler rejection.",
        "limitations": "Only the bounded callback contract is tested; target algorithm correctness and target-byte compatibility remain unproven.",
        "verified_properties": [
          "input-bound",
          "missing-handler-rejection",
          "output-bound",
          "output-type-check"
        ],
        "unproven_properties": [
          "target-algorithm",
          "target-byte-compatibility"
        ]
      },
      "next_gate": "Prove the low-level routine recompiles correctly or implement a clean-room callback and compare only private output hashes."
    },
    {
      "id": "timers",
      "runtime_status": "partial",
      "fundamental_blocker": false,
      "target_evidence": [
        {